"No.","Time","Source","Destination","Protocol","Length","Info"
"1","0.000000000","192.168.1.50","192.168.1.255","ALLJOYN-NS","187","VERSION 1 ISAT"
"2","2.456802154","192.168.1.11","255.255.255.255","UDP","46","45227  >  10001 Len=4"
"3","3.688849037","52.96.79.210","192.168.1.208","TLSv1.2","98","Application Data"
"4","3.688892472","192.168.1.208","52.96.79.210","TCP","54","50980  >  443 [ACK] Seq=1 Ack=45 Win=501 Len=0"
"5","4.663115949","192.168.1.208","192.168.1.1","DNS","94","Standard query 0x3bcb A psychology.illinois.edu OPT"
"6","4.663664310","192.168.1.208","192.168.1.1","DNS","90","Standard query 0x1ff2 A ajax.googleapis.com OPT"
"7","4.664123592","192.168.1.208","192.168.1.1","DNS","105","Standard query 0xc85d A onetrust.techservices.illinois.edu OPT"
"8","4.674907746","192.168.1.1","192.168.1.208","DNS","110","Standard query response 0x3bcb A psychology.illinois.edu A 128.174.199.60 OPT"
"9","4.674908303","192.168.1.1","192.168.1.208","DNS","106","Standard query response 0x1ff2 A ajax.googleapis.com A 142.250.191.202 OPT"
"10","4.674908448","192.168.1.1","192.168.1.208","DNS","212","Standard query response 0xc85d A onetrust.techservices.illinois.edu CNAME d29t71yt82cq8p.cloudfront.net A 13.249.87.39 A 13.249.87.44 A 13.249.87.45 A 13.249.87.53 OPT"
"11","4.675852675","192.168.1.208","128.174.199.60","TCP","74","56042  >  443 [SYN] Seq=0 Win=64240 Len=0 MSS=1460 SACK_PERM=1 TSval=3899496026 TSecr=0 WS=128"
"12","4.678176381","192.168.1.208","192.168.1.1","DNS","91","Standard query 0x3606 A fonts.googleapis.com OPT"
"13","4.678404388","192.168.1.208","142.250.191.202","QUIC","1392","Initial, DCID=fc3da721488bc03e"
"14","4.679002260","192.168.1.208","13.249.87.53","TCP","74","51872  >  443 [SYN] Seq=0 Win=64240 Len=0 MSS=1460 SACK_PERM=1 TSval=639547864 TSecr=0 WS=128"
"15","4.680154704","192.168.1.208","192.168.1.1","DNS","88","Standard query 0xa8d8 A fonts.gstatic.com OPT"
"16","4.685625588","192.168.1.1","192.168.1.208","DNS","107","Standard query response 0x3606 A fonts.googleapis.com A 172.217.6.106 OPT"
"17","4.687749024","192.168.1.208","172.217.6.106","QUIC","1392","Initial, DCID=b888e336f6914e59"
"18","4.690589192","192.168.1.1","192.168.1.208","DNS","140","Standard query response 0xa8d8 A fonts.gstatic.com CNAME gstaticadssl.l.google.com A 142.250.190.131 OPT"
"19","4.692898593","13.249.87.53","192.168.1.208","TCP","74","443  >  51872 [SYN, ACK] Seq=0 Ack=1 Win=65535 Len=0 MSS=1440 SACK_PERM=1 TSval=4287694226 TSecr=639547864 WS=512"
"20","4.692954926","192.168.1.208","13.249.87.53","TCP","66","51872  >  443 [ACK] Seq=1 Ack=1 Win=64256 Len=0 TSval=639547878 TSecr=4287694226"
"21","4.693036710","192.168.1.208","142.250.190.131","QUIC","1392","Initial, DCID=cdc58583a92b6b4f"
"22","4.693693482","192.168.1.208","13.249.87.53","TLSv1.3","583","Client Hello"
"23","4.696452951","128.174.199.60","192.168.1.208","TCP","74","443  >  56042 [SYN, ACK] Seq=0 Ack=1 Win=65160 Len=0 MSS=1460 SACK_PERM=1 TSval=2393033784 TSecr=3899496026 WS=128"
"24","4.696539802","192.168.1.208","128.174.199.60","TCP","66","56042  >  443 [ACK] Seq=1 Ack=1 Win=64256 Len=0 TSval=3899496046 TSecr=2393033784"
"25","4.697137350","192.168.1.208","128.174.199.60","TLSv1.3","583","Client Hello"
"26","4.705818839","142.250.191.202","192.168.1.208","QUIC","1392","Protected Payload (KP0)"
"27","4.708286659","192.168.1.208","142.250.191.202","QUIC","1392","Handshake, DCID=fc3da721488bc03e"
"28","4.711154900","13.249.87.53","192.168.1.208","TCP","66","443  >  51872 [ACK] Seq=1 Ack=518 Win=67072 Len=0 TSval=4287694244 TSecr=639547879"
"29","4.711155408","13.249.87.53","192.168.1.208","TLSv1.3","2922","Server Hello, Change Cipher Spec, Application Data"
"30","4.711227059","192.168.1.208","13.249.87.53","TCP","66","51872  >  443 [ACK] Seq=518 Ack=2857 Win=63488 Len=0 TSval=639547896 TSecr=4287694244"
"31","4.713108574","13.249.87.53","192.168.1.208","TCP","1494","443  >  51872 [PSH, ACK] Seq=2857 Ack=518 Win=67072 Len=1428 TSval=4287694244 TSecr=639547879 [TCP segment of a reassembled PDU]"
"32","4.713128879","192.168.1.208","13.249.87.53","TCP","66","51872  >  443 [ACK] Seq=518 Ack=4285 Win=64128 Len=0 TSval=639547898 TSecr=4287694244"
"33","4.713108812","172.217.6.106","192.168.1.208","QUIC","1392","Protected Payload (KP0)"
"34","4.713108915","13.249.87.53","192.168.1.208","TLSv1.3","1673","Application Data, Application Data, Application Data"
"35","4.713181487","192.168.1.208","13.249.87.53","TCP","66","51872  >  443 [ACK] Seq=518 Ack=5892 Win=62720 Len=0 TSval=639547898 TSecr=4287694246"
"36","4.714047973","192.168.1.208","142.250.191.202","QUIC","125","Handshake, DCID=fc3da721488bc03e"
"37","4.714439697","192.168.1.208","142.250.191.202","QUIC","112","Protected Payload (KP0), DCID=fc3da721488bc03e"
"38","4.716371714","192.168.1.208","172.217.6.106","QUIC","1392","Initial, DCID=b888e336f6914e59"
"39","4.716700713","128.174.199.60","192.168.1.208","TCP","66","443  >  56042 [ACK] Seq=1 Ack=518 Win=64768 Len=0 TSval=2393033807 TSecr=3899496047"
"40","4.716701100","142.250.190.131","192.168.1.208","QUIC","1392","Protected Payload (KP0)"
"41","4.717855896","192.168.1.208","172.217.6.106","QUIC","83","Handshake, DCID=b888e336f6914e59"
"42","4.718086912","192.168.1.208","142.250.190.131","QUIC","1392","Initial, DCID=cdc58583a92b6b4f"
"43","4.718847393","128.174.199.60","192.168.1.208","TLSv1.3","2962","Server Hello, Change Cipher Spec, Application Data"
"44","4.718875364","192.168.1.208","128.174.199.60","TCP","66","56042  >  443 [ACK] Seq=518 Ack=2897 Win=63488 Len=0 TSval=3899496069 TSecr=2393033808"
"45","4.718847868","128.174.199.60","192.168.1.208","TCP","1266","443  >  56042 [PSH, ACK] Seq=2897 Ack=518 Win=64768 Len=1200 TSval=2393033808 TSecr=3899496047 [TCP segment of a reassembled PDU]"
"46","4.718920221","192.168.1.208","128.174.199.60","TCP","66","56042  >  443 [ACK] Seq=518 Ack=4097 Win=62336 Len=0 TSval=3899496069 TSecr=2393033808"
"47","4.719592190","192.168.1.208","142.250.190.131","QUIC","83","Handshake, DCID=cdc58583a92b6b4f"
"48","4.726063182","142.250.191.202","192.168.1.208","QUIC","670","Protected Payload (KP0)"
"49","4.726063727","142.250.191.202","192.168.1.208","QUIC","119","Protected Payload (KP0)"
"50","4.728028031","192.168.1.208","172.217.6.106","QUIC","125","Handshake, DCID=b888e336f6914e59"
"51","4.728582251","192.168.1.208","172.217.6.106","QUIC","111","Protected Payload (KP0), DCID=b888e336f6914e59"
"52","4.731984595","128.174.199.60","192.168.1.208","TLSv1.3","1685","Application Data, Application Data, Application Data"
"53","4.732019380","192.168.1.208","128.174.199.60","TCP","66","56042  >  443 [ACK] Seq=518 Ack=5716 Win=63872 Len=0 TSval=3899496082 TSecr=2393033822"
"54","4.732516286","192.168.1.208","13.249.87.53","TLSv1.3","130","Change Cipher Spec, Application Data"
"55","4.733025455","192.168.1.208","142.250.191.202","QUIC","75","Protected Payload (KP0), DCID=fc3da721488bc03e"
"56","4.735704432","192.168.1.208","142.250.190.131","QUIC","125","Handshake, DCID=cdc58583a92b6b4f"
"57","4.736123536","192.168.1.208","142.250.190.131","QUIC","112","Protected Payload (KP0), DCID=cdc58583a92b6b4f"
"58","4.739094498","172.217.6.106","192.168.1.208","QUIC","670","Protected Payload (KP0)"
"59","4.739094742","172.217.6.106","192.168.1.208","QUIC","119","Protected Payload (KP0)"
"60","4.739412979","192.168.1.208","172.217.6.106","QUIC","75","Protected Payload (KP0), DCID=b888e336f6914e59"
"61","4.742151259","192.168.1.208","128.174.199.60","TLSv1.3","130","Change Cipher Spec, Application Data"
"62","4.742429197","192.168.1.208","128.174.199.60","TLSv1.3","158","Application Data"
"63","4.742866342","192.168.1.208","128.174.199.60","TLSv1.3","830","Application Data"
"64","4.743400953","13.249.87.53","192.168.1.208","TCP","66","443  >  51872 [ACK] Seq=5892 Ack=582 Win=67072 Len=0 TSval=4287694277 TSecr=639547917"
"65","4.743401244","13.249.87.53","192.168.1.208","TLSv1.3","128","Application Data"
"66","4.743439444","192.168.1.208","13.249.87.53","TCP","66","51872  >  443 [ACK] Seq=582 Ack=5954 Win=64128 Len=0 TSval=639547928 TSecr=4287694277"
"67","4.747042526","142.250.190.131","192.168.1.208","QUIC","670","Protected Payload (KP0)"
"68","4.747042772","142.250.190.131","192.168.1.208","QUIC","119","Protected Payload (KP0)"
"69","4.747388526","192.168.1.208","142.250.190.131","QUIC","75","Protected Payload (KP0), DCID=cdc58583a92b6b4f"
"70","4.750419472","142.250.191.202","192.168.1.208","QUIC","67","Protected Payload (KP0)"
"71","4.756243194","128.174.199.60","192.168.1.208","TCP","66","443  >  56042 [ACK] Seq=5716 Ack=582 Win=64768 Len=0 TSval=2393033846 TSecr=3899496092"
"72","4.756243507","128.174.199.60","192.168.1.208","TLSv1.3","145","Application Data"
"73","4.756276231","192.168.1.208","128.174.199.60","TCP","66","56042  >  443 [ACK] Seq=1438 Ack=5795 Win=64128 Len=0 TSval=3899496106 TSecr=2393033846"
"74","4.756243572","128.174.199.60","192.168.1.208","TLSv1.3","145","Application Data"
"75","4.756301379","192.168.1.208","128.174.199.60","TCP","66","56042  >  443 [ACK] Seq=1438 Ack=5874 Win=64128 Len=0 TSval=3899496106 TSecr=2393033846"
"76","4.756243643","128.174.199.60","192.168.1.208","TLSv1.3","128","Application Data"
"77","4.756308640","192.168.1.208","128.174.199.60","TCP","66","56042  >  443 [ACK] Seq=1438 Ack=5936 Win=64128 Len=0 TSval=3899496106 TSecr=2393033847"
"78","4.756243710","128.174.199.60","192.168.1.208","TCP","66","443  >  56042 [ACK] Seq=5936 Ack=674 Win=64768 Len=0 TSval=2393033847 TSecr=3899496092"
"79","4.756243779","128.174.199.60","192.168.1.208","TLSv1.3","97","Application Data"
"80","4.756317799","192.168.1.208","128.174.199.60","TCP","66","56042  >  443 [ACK] Seq=1438 Ack=5967 Win=64128 Len=0 TSval=3899496106 TSecr=2393033847"
"81","4.756535830","192.168.1.208","128.174.199.60","TLSv1.3","97","Application Data"
"82","4.757757364","128.174.199.60","192.168.1.208","TCP","66","443  >  56042 [ACK] Seq=5967 Ack=1438 Win=64128 Len=0 TSval=2393033847 TSecr=3899496093"
"83","4.758732035","192.168.1.208","142.250.191.202","QUIC","75","Protected Payload (KP0), DCID=fc3da721488bc03e"
"84","4.765036945","192.168.1.208","172.217.6.106","QUIC","75","Protected Payload (KP0), DCID=b888e336f6914e59"
"85","4.765101056","172.217.6.106","192.168.1.208","QUIC","67","Protected Payload (KP0)"
"86","4.770357636","128.174.199.60","192.168.1.208","TCP","66","443  >  56042 [ACK] Seq=5967 Ack=1469 Win=64128 Len=0 TSval=2393033861 TSecr=3899496106"
"87","4.772037775","142.250.190.131","192.168.1.208","QUIC","67","Protected Payload (KP0)"
"88","4.773429424","192.168.1.208","142.250.190.131","QUIC","75","Protected Payload (KP0), DCID=cdc58583a92b6b4f"
"89","5.226291218","128.174.199.60","192.168.1.208","TCP","2962","443  >  56042 [PSH, ACK] Seq=5967 Ack=1469 Win=64128 Len=2896 TSval=2393034203 TSecr=3899496106 [TCP segment of a reassembled PDU]"
"90","5.226358276","192.168.1.208","128.174.199.60","TCP","66","56042  >  443 [ACK] Seq=1469 Ack=8863 Win=63488 Len=0 TSval=3899496576 TSecr=2393034203"
"91","5.226291745","128.174.199.60","192.168.1.208","TLSv1.3","1137","Application Data"
"92","5.226411567","192.168.1.208","128.174.199.60","TCP","66","56042  >  443 [ACK] Seq=1469 Ack=9934 Win=62592 Len=0 TSval=3899496576 TSecr=2393034203"
"93","5.226291854","128.174.199.60","192.168.1.208","TCP","2962","443  >  56042 [PSH, ACK] Seq=9934 Ack=1469 Win=64128 Len=2896 TSval=2393034203 TSecr=3899496106 [TCP segment of a reassembled PDU]"
"94","5.226430293","192.168.1.208","128.174.199.60","TCP","66","56042  >  443 [ACK] Seq=1469 Ack=12830 Win=60544 Len=0 TSval=3899496576 TSecr=2393034203"
"95","5.226292215","128.174.199.60","192.168.1.208","TLSv1.3","1212","Application Data"
"96","5.226445179","192.168.1.208","128.174.199.60","TCP","66","56042  >  443 [ACK] Seq=1469 Ack=13976 Win=59648 Len=0 TSval=3899496576 TSecr=2393034203"
"97","5.226626983","128.174.199.60","192.168.1.208","TCP","2962","443  >  56042 [PSH, ACK] Seq=13976 Ack=1469 Win=64128 Len=2896 TSval=2393034204 TSecr=3899496106 [TCP segment of a reassembled PDU]"
"98","5.226642859","192.168.1.208","128.174.199.60","TCP","66","56042  >  443 [ACK] Seq=1469 Ack=16872 Win=63488 Len=0 TSval=3899496577 TSecr=2393034204"
"99","5.226627179","128.174.199.60","192.168.1.208","TLSv1.3","1291","Application Data"
"100","5.226665702","192.168.1.208","128.174.199.60","TCP","66","56042  >  443 [ACK] Seq=1469 Ack=18097 Win=62592 Len=0 TSval=3899496577 TSecr=2393034204"
"101","5.226627304","128.174.199.60","192.168.1.208","TCP","1514","443  >  56042 [ACK] Seq=18097 Ack=1469 Win=64128 Len=1448 TSval=2393034204 TSecr=3899496106 [TCP segment of a reassembled PDU]"
"102","5.226679657","192.168.1.208","128.174.199.60","TCP","66","56042  >  443 [ACK] Seq=1469 Ack=19545 Win=61440 Len=0 TSval=3899496577 TSecr=2393034204"
"103","5.226627436","3.211.86.134","192.168.1.208","TLSv1.2","729","Application Data"
"104","5.226719367","192.168.1.208","3.211.86.134","TCP","66","50526  >  443 [ACK] Seq=1 Ack=664 Win=501 Len=0 TSval=2903405785 TSecr=5346135"
"105","5.226627547","128.174.199.60","192.168.1.208","TCP","1514","443  >  56042 [ACK] Seq=19545 Ack=1469 Win=64128 Len=1448 TSval=2393034251 TSecr=3899496106 [TCP segment of a reassembled PDU]"
"106","5.226736638","192.168.1.208","128.174.199.60","TCP","66","56042  >  443 [ACK] Seq=1469 Ack=20993 Win=60416 Len=0 TSval=3899496577 TSecr=2393034251"
"107","5.241711407","128.174.199.60","192.168.1.208","TLSv1.3","289","Application Data, Application Data, Application Data"
"108","5.241750918","192.168.1.208","128.174.199.60","TCP","66","56042  >  443 [ACK] Seq=1469 Ack=21216 Win=63104 Len=0 TSval=3899496592 TSecr=2393034332"
"109","5.249009984","192.168.1.208","192.168.1.1","DNS","91","Standard query 0xa770 A mx.technolutions.net OPT"
"110","5.260924048","192.168.1.1","192.168.1.208","DNS","155","Standard query response 0xa770 A mx.technolutions.net A 99.84.174.32 A 99.84.174.3 A 99.84.174.115 A 99.84.174.69 OPT"
"111","5.262012837","192.168.1.208","99.84.174.32","TCP","74","50982  >  443 [SYN] Seq=0 Win=64240 Len=0 MSS=1460 SACK_PERM=1 TSval=454373110 TSecr=0 WS=128"
"112","5.273703127","99.84.174.32","192.168.1.208","TCP","74","443  >  50982 [SYN, ACK] Seq=0 Ack=1 Win=65535 Len=0 MSS=1440 SACK_PERM=1 TSval=3915695706 TSecr=454373110 WS=512"
"113","5.273768253","192.168.1.208","99.84.174.32","TCP","66","50982  >  443 [ACK] Seq=1 Ack=1 Win=64256 Len=0 TSval=454373122 TSecr=3915695706"
"114","5.274285035","192.168.1.208","99.84.174.32","TLSv1.3","583","Client Hello"
"115","5.287376932","99.84.174.32","192.168.1.208","TCP","66","443  >  50982 [ACK] Seq=1 Ack=518 Win=67072 Len=0 TSval=3915695720 TSecr=454373122"
"116","5.290166514","99.84.174.32","192.168.1.208","TLSv1.3","1494","Server Hello, Change Cipher Spec, Application Data"
"117","5.290183186","192.168.1.208","99.84.174.32","TCP","66","50982  >  443 [ACK] Seq=518 Ack=1429 Win=63104 Len=0 TSval=454373138 TSecr=3915695723"
"118","5.292166309","99.84.174.32","192.168.1.208","TCP","2922","443  >  50982 [PSH, ACK] Seq=1429 Ack=518 Win=67072 Len=2856 TSval=3915695723 TSecr=454373122 [TCP segment of a reassembled PDU]"
"119","5.292186675","192.168.1.208","99.84.174.32","TCP","66","50982  >  443 [ACK] Seq=518 Ack=4285 Win=63488 Len=0 TSval=454373140 TSecr=3915695723"
"120","5.292166472","99.84.174.32","192.168.1.208","TLSv1.3","1645","Application Data, Application Data, Application Data"
"121","5.292213336","192.168.1.208","99.84.174.32","TCP","66","50982  >  443 [ACK] Seq=518 Ack=5864 Win=61952 Len=0 TSval=454373140 TSecr=3915695725"
"122","5.296214342","192.168.1.208","99.84.174.32","TLSv1.3","130","Change Cipher Spec, Application Data"
"123","5.296441250","192.168.1.208","99.84.174.32","TLSv1.3","158","Application Data"
"124","5.296608274","192.168.1.208","99.84.174.32","TLSv1.3","457","Application Data"
"125","5.296744093","192.168.1.208","99.84.174.32","TLSv1.3","430","Application Data"
"126","5.306538107","99.84.174.32","192.168.1.208","TCP","66","443  >  50982 [ACK] Seq=5864 Ack=582 Win=67072 Len=0 TSval=3915695739 TSecr=454373144"
"127","5.306538394","99.84.174.32","192.168.1.208","TLSv1.3","128","Application Data"
"128","5.306561919","192.168.1.208","99.84.174.32","TCP","66","50982  >  443 [ACK] Seq=1429 Ack=5926 Win=64128 Len=0 TSval=454373154 TSecr=3915695739"
"129","5.306538439","99.84.174.32","192.168.1.208","TCP","66","443  >  50982 [ACK] Seq=5926 Ack=674 Win=67072 Len=0 TSval=3915695739 TSecr=454373144"
"130","5.306538489","99.84.174.32","192.168.1.208","TLSv1.3","97","Application Data"
"131","5.306588134","192.168.1.208","99.84.174.32","TCP","66","50982  >  443 [ACK] Seq=1429 Ack=5957 Win=64128 Len=0 TSval=454373155 TSecr=3915695739"
"132","5.306538534","99.84.174.32","192.168.1.208","TCP","66","443  >  50982 [ACK] Seq=5957 Ack=1065 Win=68096 Len=0 TSval=3915695739 TSecr=454373145"
"133","5.306538589","99.84.174.32","192.168.1.208","TCP","66","443  >  50982 [ACK] Seq=5957 Ack=1429 Win=69120 Len=0 TSval=3915695740 TSecr=454373145"
"134","5.306703652","192.168.1.208","99.84.174.32","TLSv1.3","97","Application Data"
"135","5.318954419","99.84.174.32","192.168.1.208","TCP","66","443  >  50982 [ACK] Seq=5957 Ack=1460 Win=69120 Len=0 TSval=3915695751 TSecr=454373155"
"136","5.329196358","192.168.1.208","192.168.1.1","DNS","90","Standard query 0xc022 A enroll.illinois.edu OPT"
"137","5.330531479","192.168.1.208","192.168.1.1","DNS","95","Standard query 0xf6cc A www.google-analytics.com OPT"
"138","5.331585766","192.168.1.208","142.250.190.131","QUIC","1392","Initial, DCID=b7a273817492cc7a"
"139","5.338361567","192.168.1.1","192.168.1.208","DNS","146","Standard query response 0xc022 A enroll.illinois.edu CNAME cluster2.technolutions.net A 34.198.122.35 OPT"
"140","5.338361796","192.168.1.1","192.168.1.208","DNS","155","Standard query response 0xf6cc A www.google-analytics.com CNAME www-google-analytics.l.google.com A 142.250.190.14 OPT"
"141","5.338737469","192.168.1.208","34.198.122.35","TCP","74","35240  >  443 [SYN] Seq=0 Win=64240 Len=0 MSS=1460 SACK_PERM=1 TSval=651984673 TSecr=0 WS=128"
"142","5.339150047","192.168.1.208","142.250.190.14","QUIC","1392","Initial, DCID=5bc8fa61983f0273"
"143","5.355932649","142.250.190.131","192.168.1.208","QUIC","1392","Protected Payload (KP0)"
"144","5.356467185","192.168.1.208","142.250.190.131","QUIC","201","Protected Payload (KP0), DCID=b7a273817492cc7a"
"145","5.361928308","142.250.190.14","192.168.1.208","QUIC","1392","Protected Payload (KP0)"
"146","5.363698091","192.168.1.208","142.250.190.14","QUIC","1392","Handshake, DCID=5bc8fa61983f0273"
"147","5.364451950","192.168.1.208","142.250.190.14","QUIC","125","Handshake, DCID=5bc8fa61983f0273"
"148","5.364567725","192.168.1.208","142.250.190.14","QUIC","108","Protected Payload (KP0), DCID=5bc8fa61983f0273"
"149","5.364792620","192.168.1.208","142.250.190.14","QUIC","413","Protected Payload (KP0), DCID=5bc8fa61983f0273"
"150","5.368858255","142.250.190.131","192.168.1.208","QUIC","670","Protected Payload (KP0)"
"151","5.368858317","142.250.190.131","192.168.1.208","QUIC","119","Protected Payload (KP0)"
"152","5.368858346","34.198.122.35","192.168.1.208","TCP","74","443  >  35240 [SYN, ACK] Seq=0 Ack=1 Win=23360 Len=0 MSS=1460 WS=512 SACK_PERM=1 TSval=910707625 TSecr=651984673"
"153","5.368885445","192.168.1.208","34.198.122.35","TCP","66","35240  >  443 [ACK] Seq=1 Ack=1 Win=64256 Len=0 TSval=651984703 TSecr=910707625"
"154","5.368951110","192.168.1.208","142.250.190.131","QUIC","75","Protected Payload (KP0), DCID=b7a273817492cc7a"
"155","5.369120528","192.168.1.208","34.198.122.35","TLSv1.2","583","Client Hello"
"156","5.375055931","142.250.190.14","192.168.1.208","QUIC","670","Protected Payload (KP0)"
"157","5.375056089","142.250.190.14","192.168.1.208","QUIC","119","Protected Payload (KP0)"
"158","5.375056118","142.250.190.14","192.168.1.208","QUIC","319","Protected Payload (KP0)"
"159","5.375056147","142.250.190.14","192.168.1.208","QUIC","67","Protected Payload (KP0)"
"160","5.375268994","192.168.1.208","142.250.190.14","QUIC","75","Protected Payload (KP0), DCID=5bc8fa61983f0273"
"161","5.375409359","192.168.1.208","142.250.190.14","QUIC","77","Protected Payload (KP0), DCID=5bc8fa61983f0273"
"162","5.386328276","192.168.1.208","192.168.1.1","DNS","91","Standard query 0x1491 A cdnjs.cloudflare.com OPT"
"163","5.394939567","192.168.1.208","142.250.190.131","QUIC","75","Protected Payload (KP0), DCID=b7a273817492cc7a"
"164","5.396158189","142.250.190.131","192.168.1.208","QUIC","67","Protected Payload (KP0)"
"165","5.396158458","192.168.1.1","192.168.1.208","DNS","123","Standard query response 0x1491 A cdnjs.cloudflare.com A 104.16.19.94 A 104.16.18.94 OPT"
"166","5.400680173","192.168.1.208","142.250.190.14","QUIC","75","Protected Payload (KP0), DCID=5bc8fa61983f0273"
"167","5.402485006","34.198.122.35","192.168.1.208","TCP","66","443  >  35240 [ACK] Seq=1 Ack=518 Win=23552 Len=0 TSval=910707658 TSecr=651984703"
"168","5.404062295","34.198.122.35","192.168.1.208","TLSv1.2","1514","Server Hello"
"169","5.404088710","192.168.1.208","34.198.122.35","TCP","66","35240  >  443 [ACK] Seq=518 Ack=1449 Win=64128 Len=0 TSval=651984738 TSecr=910707658"
"170","5.404062535","34.198.122.35","192.168.1.208","TCP","1514","443  >  35240 [ACK] Seq=1449 Ack=518 Win=23552 Len=1448 TSval=910707658 TSecr=651984703 [TCP segment of a reassembled PDU]"
"171","5.404116340","192.168.1.208","34.198.122.35","TCP","66","35240  >  443 [ACK] Seq=518 Ack=2897 Win=63360 Len=0 TSval=651984738 TSecr=910707658"
"172","5.404523543","192.168.1.208","192.168.1.1","DNS","90","Standard query 0xf093 A pixel.sitescout.com OPT"
"173","5.405890206","34.198.122.35","192.168.1.208","TLSv1.2","2172","Certificate, Certificate Status, Server Key Exchange, Server Hello Done"
"174","5.405902070","192.168.1.208","34.198.122.35","TCP","66","35240  >  443 [ACK] Seq=518 Ack=5003 Win=63872 Len=0 TSval=651984740 TSecr=910707658"
"175","5.411361905","142.250.190.14","192.168.1.208","QUIC","67","Protected Payload (KP0)"
"176","5.411362091","192.168.1.1","192.168.1.208","DNS","106","Standard query response 0xf093 A pixel.sitescout.com A 216.152.140.211 OPT"
"177","5.411616679","192.168.1.208","34.198.122.35","TLSv1.2","192","Client Key Exchange, Change Cipher Spec, Encrypted Handshake Message"
"178","5.411724785","192.168.1.208","216.152.140.211","TCP","74","55004  >  443 [SYN] Seq=0 Win=64240 Len=0 MSS=1460 SACK_PERM=1 TSval=1534822357 TSecr=0 WS=128"
"179","5.438869053","99.84.174.32","192.168.1.208","TLSv1.3","586","Application Data"
"180","5.438881444","192.168.1.208","99.84.174.32","TCP","66","50982  >  443 [ACK] Seq=1460 Ack=6477 Win=64128 Len=0 TSval=454373287 TSecr=3915695872"
"181","5.438869229","99.84.174.32","192.168.1.208","TLSv1.3","97","Application Data"
"182","5.438898268","192.168.1.208","99.84.174.32","TCP","66","50982  >  443 [ACK] Seq=1460 Ack=6508 Win=64128 Len=0 TSval=454373287 TSecr=3915695872"
"183","5.442133208","34.198.122.35","192.168.1.208","TCP","66","443  >  35240 [ACK] Seq=5003 Ack=644 Win=23552 Len=0 TSval=910707698 TSecr=651984746"
"184","5.442133367","34.198.122.35","192.168.1.208","TLSv1.2","117","Change Cipher Spec, Encrypted Handshake Message"
"185","5.442149766","192.168.1.208","34.198.122.35","TCP","66","35240  >  443 [ACK] Seq=644 Ack=5054 Win=64128 Len=0 TSval=651984776 TSecr=910707698"
"186","5.442133397","216.152.140.211","192.168.1.208","TCP","62","443  >  55004 [SYN, ACK] Seq=0 Ack=1 Win=29200 Len=0 MSS=1460 WS=256"
"187","5.442173780","192.168.1.208","216.152.140.211","TCP","54","55004  >  443 [ACK] Seq=1 Ack=1 Win=64256 Len=0"
"188","5.442449514","192.168.1.208","216.152.140.211","TLSv1.2","571","Client Hello"
"189","5.442574043","192.168.1.208","34.198.122.35","TLSv1.2","1147","Application Data"
"190","5.468294341","192.168.1.208","142.250.190.14","QUIC","463","Protected Payload (KP0), DCID=5bc8fa61983f0273"
"191","5.476040062","34.198.122.35","192.168.1.208","TCP","66","443  >  35240 [ACK] Seq=5054 Ack=1725 Win=24576 Len=0 TSval=910707732 TSecr=651984777"
"192","5.478830855","216.152.140.211","192.168.1.208","TLSv1.2","1514","Server Hello"
"193","5.478852781","192.168.1.208","216.152.140.211","TCP","54","55004  >  443 [ACK] Seq=518 Ack=1461 Win=63104 Len=0"
"194","5.480619802","216.152.140.211","192.168.1.208","TLSv1.2","1869","Certificate, Server Key Exchange, Server Hello Done"
"195","5.480634496","192.168.1.208","216.152.140.211","TCP","54","55004  >  443 [ACK] Seq=518 Ack=3276 Win=63872 Len=0"
"196","5.480619966","142.250.190.14","192.168.1.208","QUIC","69","Protected Payload (KP0)"
"197","5.484097930","192.168.1.208","216.152.140.211","TLSv1.2","172","Client Key Exchange, Change Cipher Spec, Encrypted Handshake Message"
"198","5.484433591","192.168.1.208","216.152.140.211","TLSv1.2","1140","Application Data, Application Data"
"199","5.485005828","192.168.1.208","216.152.140.211","TLSv1.2","240","Application Data"
"200","5.490126061","142.250.190.14","192.168.1.208","QUIC","274","Protected Payload (KP0)"
"201","5.490500331","192.168.1.208","142.250.190.14","QUIC","77","Protected Payload (KP0), DCID=5bc8fa61983f0273"
"202","5.502849239","34.198.122.35","192.168.1.208","TLSv1.2","976","Application Data"
"203","5.502865160","192.168.1.208","34.198.122.35","TCP","66","35240  >  443 [ACK] Seq=1725 Ack=5964 Win=63232 Len=0 TSval=651984837 TSecr=910707759"
"204","5.516066986","216.152.140.211","192.168.1.208","TCP","60","443  >  55004 [ACK] Seq=3276 Ack=1722 Win=32512 Len=0"
"205","5.516067148","216.152.140.211","192.168.1.208","TLSv1.2","97","Change Cipher Spec, Encrypted Handshake Message"
"206","5.516094003","192.168.1.208","216.152.140.211","TCP","54","55004  >  443 [ACK] Seq=1908 Ack=3319 Win=64128 Len=0"
"207","5.516067183","216.152.140.211","192.168.1.208","TLSv1.2","111","Application Data"
"208","5.516105672","192.168.1.208","216.152.140.211","TCP","54","55004  >  443 [ACK] Seq=1908 Ack=3376 Win=64128 Len=0"
"209","5.516067216","216.152.140.211","192.168.1.208","TLSv1.2","2436","Application Data"
"210","5.516108845","192.168.1.208","216.152.140.211","TCP","54","55004  >  443 [ACK] Seq=1908 Ack=5758 Win=62976 Len=0"
"211","5.516067254","216.152.140.211","192.168.1.208","TLSv1.2","431","Application Data"
"212","5.516111314","192.168.1.208","216.152.140.211","TCP","54","55004  >  443 [ACK] Seq=1908 Ack=6135 Win=62720 Len=0"
"213","5.516067287","216.152.140.211","192.168.1.208","TLSv1.2","136","Application Data"
"214","5.516113682","192.168.1.208","216.152.140.211","TCP","54","55004  >  443 [ACK] Seq=1908 Ack=6217 Win=62720 Len=0"
"215","5.517423649","192.168.1.208","216.152.140.211","TLSv1.2","84","Application Data"
"216","5.528600930","142.250.190.14","192.168.1.208","QUIC","67","Protected Payload (KP0)"
"217","5.581449016","192.168.1.208","192.168.1.1","DNS","89","Standard query 0x25a5 A www.googleapis.com OPT"
"218","5.584473998","192.168.1.1","192.168.1.208","DNS","345","Standard query response 0x25a5 A www.googleapis.com A 142.250.191.170 A 172.217.5.10 A 172.217.0.10 A 142.250.190.42 A 142.250.190.138 A 142.250.190.74 A 216.58.192.234 A 172.217.4.42 A 216.58.192.138 A 142.250.191.106 A 172.217.9.42 A 172.217.9.74 A 172.217.6.10 A 142.250.190.106 A 142.250.191.138 A 142.250.191.202 OPT"
"219","5.585339486","192.168.1.208","142.250.191.170","QUIC","1392","Initial, DCID=40161cf9d1d65654"
"220","5.590000132","216.152.140.211","192.168.1.208","TCP","60","443  >  55004 [ACK] Seq=6217 Ack=1938 Win=34816 Len=0"
"221","5.607672596","142.250.191.170","192.168.1.208","QUIC","1392","Protected Payload (KP0)"
"222","5.608317336","192.168.1.208","142.250.191.170","QUIC","202","Protected Payload (KP0), DCID=40161cf9d1d65654"
"223","5.608493363","192.168.1.208","142.250.191.170","QUIC","363","Protected Payload (KP0), DCID=40161cf9d1d65654"
"224","5.608573185","192.168.1.208","142.250.191.170","QUIC","129","Protected Payload (KP0), DCID=40161cf9d1d65654"
"225","5.620421929","142.250.191.170","192.168.1.208","QUIC","670","Protected Payload (KP0)"
"226","5.620422114","142.250.191.170","192.168.1.208","QUIC","119","Protected Payload (KP0)"
"227","5.620422147","142.250.191.170","192.168.1.208","QUIC","69","Protected Payload (KP0)"
"228","5.620422180","142.250.191.170","192.168.1.208","QUIC","67","Protected Payload (KP0)"
"229","5.620422213","142.250.191.170","192.168.1.208","QUIC","67","Protected Payload (KP0)"
"230","5.620648452","192.168.1.208","142.250.191.170","QUIC","75","Protected Payload (KP0), DCID=40161cf9d1d65654"
"231","5.620755415","192.168.1.208","142.250.191.170","QUIC","75","Protected Payload (KP0), DCID=40161cf9d1d65654"
"232","5.637719047","192.168.1.208","192.168.1.1","DNS","86","Standard query 0x1560 A pixel.tapad.com OPT"
"233","5.638841100","192.168.1.208","192.168.1.1","DNS","92","Standard query 0x1fff A pixel.advertising.com OPT"
"234","5.638941290","192.168.1.208","192.168.1.1","DNS","93","Standard query 0x9d69 A match.sharethrough.com OPT"
"235","5.638957251","142.250.191.170","192.168.1.208","QUIC","1388","Protected Payload (KP0)"
"236","5.638957331","142.250.191.170","192.168.1.208","QUIC","67","Protected Payload (KP0)"
"237","5.638957390","142.250.191.170","192.168.1.208","QUIC","1178","Protected Payload (KP0)"
"238","5.639037211","192.168.1.208","192.168.1.1","DNS","83","Standard query 0x58a3 A ib.adnxs.com OPT"
"239","5.639104192","192.168.1.208","142.250.191.170","QUIC","77","Protected Payload (KP0), DCID=40161cf9d1d65654"
"240","5.639148188","192.168.1.208","192.168.1.1","DNS","98","Standard query 0x9ee8 A rtb-csync.smartadserver.com OPT"
"241","5.639196586","192.168.1.208","142.250.191.170","QUIC","77","Protected Payload (KP0), DCID=40161cf9d1d65654"
"242","5.641133751","192.168.1.208","128.174.199.60","TLSv1.3","522","Application Data"
"243","5.647425267","192.168.1.1","192.168.1.208","DNS","102","Standard query response 0x1560 A pixel.tapad.com A 107.178.246.49 OPT"
"244","5.647710305","192.168.1.208","107.178.246.49","TCP","74","45336  >  443 [SYN] Seq=0 Win=64240 Len=0 MSS=1460 SACK_PERM=1 TSval=859636849 TSecr=0 WS=128"
"245","5.649146218","192.168.1.1","192.168.1.208","DNS","308","Standard query response 0x1fff A pixel.advertising.com CNAME prod.ups-adcom.aolp-ds-prd.aws.oath.cloud CNAME prod.ups-us-east-1.aolp-ds-prd.aws.oath.cloud A 23.22.59.0 A 35.174.187.169 A 3.84.70.76 A 23.22.206.119 A 18.211.242.71 A 54.166.75.246 A 3.227.33.114 A 52.201.141.91 OPT"
"246","5.649146370","192.168.1.1","192.168.1.208","DNS","223","Standard query response 0x9d69 A match.sharethrough.com CNAME match-us-east-1-ecs.sharethrough.com A 54.236.120.153 A 52.71.138.167 A 52.73.6.123 A 52.201.150.102 A 18.211.160.92 A 54.198.177.131 OPT"
"247","5.649735908","192.168.1.208","52.201.141.91","TCP","74","46110  >  443 [SYN] Seq=0 Win=64240 Len=0 MSS=1460 SACK_PERM=1 TSval=2707878720 TSecr=0 WS=128"
"248","5.649895318","192.168.1.208","54.198.177.131","TCP","74","42308  >  443 [SYN] Seq=0 Win=64240 Len=0 MSS=1460 SACK_PERM=1 TSval=4032400211 TSecr=0 WS=128"
"249","5.651132857","192.168.1.1","192.168.1.208","DNS","260","Standard query response 0x58a3 A ib.adnxs.com CNAME g.geogslb.com CNAME ib.anycast.adnxs.com A 68.67.178.22 A 68.67.161.183 A 68.67.179.121 A 68.67.179.123 A 68.67.160.24 A 68.67.179.164 A 68.67.161.206 A 68.67.181.211 OPT"
"250","5.651132905","142.250.191.170","192.168.1.208","QUIC","67","Protected Payload (KP0)"
"251","5.651132947","192.168.1.1","192.168.1.208","DNS","234","Standard query response 0x9ee8 A rtb-csync.smartadserver.com CNAME 2-01-275d-002d.cdx.cedexis.net CNAME rtb-csync-tmk.smartadserver.com A 199.187.193.185 A 199.187.193.193 A 199.187.193.192 A 199.187.193.166 OPT"
"252","5.651744535","192.168.1.208","68.67.181.211","TCP","74","48826  >  443 [SYN] Seq=0 Win=64240 Len=0 MSS=1460 SACK_PERM=1 TSval=2093655397 TSecr=0 WS=128"
"253","5.651798287","192.168.1.208","199.187.193.166","TCP","74","55654  >  443 [SYN] Seq=0 Win=64240 Len=0 MSS=1460 SACK_PERM=1 TSval=915805 TSecr=0 WS=128"
"254","5.656037661","128.174.199.60","192.168.1.208","TCP","66","443  >  56042 [ACK] Seq=21216 Ack=1925 Win=64128 Len=0 TSval=2393034746 TSecr=3899496991"
"255","5.656037803","128.174.199.60","192.168.1.208","TLSv1.3","1807","Application Data"
"256","5.656059544","192.168.1.208","128.174.199.60","TCP","66","56042  >  443 [ACK] Seq=1925 Ack=22957 Win=63872 Len=0 TSval=3899497006 TSecr=2393034747"
"257","5.656037834","128.174.199.60","192.168.1.208","TLSv1.3","97","Application Data"
"258","5.656080487","192.168.1.208","128.174.199.60","TCP","66","56042  >  443 [ACK] Seq=1925 Ack=22988 Win=63872 Len=0 TSval=3899497006 TSecr=2393034747"
"259","5.662763644","107.178.246.49","192.168.1.208","TCP","74","443  >  45336 [SYN, ACK] Seq=0 Ack=1 Win=65535 Len=0 MSS=1430 SACK_PERM=1 TSval=48468190 TSecr=859636849 WS=256"
"260","5.662791849","192.168.1.208","107.178.246.49","TCP","66","45336  >  443 [ACK] Seq=1 Ack=1 Win=64256 Len=0 TSval=859636864 TSecr=48468190"
"261","5.663012373","192.168.1.208","107.178.246.49","TLSv1.3","656","Client Hello"
"262","5.678195337","107.178.246.49","192.168.1.208","TCP","66","443  >  45336 [ACK] Seq=1 Ack=591 Win=66816 Len=0 TSval=48468205 TSecr=859636864"
"263","5.683027633","52.201.141.91","192.168.1.208","TCP","74","443  >  46110 [SYN, ACK] Seq=0 Ack=1 Win=26847 Len=0 MSS=1460 SACK_PERM=1 TSval=1637463256 TSecr=2707878720 WS=256"
"264","5.683055630","192.168.1.208","52.201.141.91","TCP","66","46110  >  443 [ACK] Seq=1 Ack=1 Win=64256 Len=0 TSval=2707878753 TSecr=1637463256"
"265","5.683027786","68.67.181.211","192.168.1.208","TCP","74","443  >  48826 [SYN, ACK] Seq=0 Ack=1 Win=26544 Len=0 MSS=8860 SACK_PERM=1 TSval=818295703 TSecr=2093655397 WS=512"
"266","5.683071686","192.168.1.208","68.67.181.211","TCP","66","48826  >  443 [ACK] Seq=1 Ack=1 Win=64256 Len=0 TSval=2093655428 TSecr=818295703"
"267","5.683027822","54.198.177.131","192.168.1.208","TCP","74","443  >  42308 [SYN, ACK] Seq=0 Ack=1 Win=26847 Len=0 MSS=1460 SACK_PERM=1 TSval=374716613 TSecr=4032400211 WS=256"
"268","5.683076803","192.168.1.208","54.198.177.131","TCP","66","42308  >  443 [ACK] Seq=1 Ack=1 Win=64256 Len=0 TSval=4032400244 TSecr=374716613"
"269","5.683280233","192.168.1.208","52.201.141.91","TLSv1.2","583","Client Hello"
"270","5.683436145","192.168.1.208","68.67.181.211","TLSv1.2","583","Client Hello"
"271","5.683550761","192.168.1.208","54.198.177.131","TLSv1.2","583","Client Hello"
"272","5.693292657","107.178.246.49","192.168.1.208","TLSv1.3","278","Server Hello, Change Cipher Spec, Application Data"
"273","5.693317594","192.168.1.208","107.178.246.49","TCP","66","45336  >  443 [ACK] Seq=591 Ack=213 Win=64128 Len=0 TSval=859636894 TSecr=48468215"
"274","5.695927767","192.168.1.208","107.178.246.49","TLSv1.3","130","Change Cipher Spec, Application Data"
"275","5.696058233","192.168.1.208","107.178.246.49","TLSv1.3","158","Application Data"
"276","5.696424491","192.168.1.208","107.178.246.49","TLSv1.3","614","Application Data"
"277","5.699216355","199.187.193.166","192.168.1.208","TCP","60","443  >  55654 [SYN, ACK] Seq=0 Ack=1 Win=1024 Len=0 MSS=1460"
"278","5.699306065","192.168.1.208","199.187.193.166","TCP","54","55654  >  443 [ACK] Seq=1 Ack=1 Win=64240 Len=0"
"279","5.699559036","192.168.1.208","199.187.193.166","TCP","566","55654  >  443 [ACK] Seq=1 Ack=1 Win=64240 Len=512 [TCP segment of a reassembled PDU]"
"280","5.700075435","192.168.1.208","199.187.193.166","TLSv1.3","59","Client Hello"
"281","5.707514987","107.178.246.49","192.168.1.208","TCP","66","443  >  45336 [ACK] Seq=213 Ack=1295 Win=68096 Len=0 TSval=48468235 TSecr=859636897"
"282","5.707515166","107.178.246.49","192.168.1.208","TLSv1.3","646","Application Data, Application Data"
"283","5.707535919","192.168.1.208","107.178.246.49","TCP","66","45336  >  443 [ACK] Seq=1295 Ack=793 Win=64128 Len=0 TSval=859636908 TSecr=48468235"
"284","5.707515197","107.178.246.49","192.168.1.208","TLSv1.3","97","Application Data"
"285","5.707554608","192.168.1.208","107.178.246.49","TCP","66","45336  >  443 [ACK] Seq=1295 Ack=824 Win=64128 Len=0 TSval=859636908 TSecr=48468235"
"286","5.707692774","192.168.1.208","107.178.246.49","TLSv1.3","97","Application Data"
"287","5.717897081","52.201.141.91","192.168.1.208","TCP","66","443  >  46110 [ACK] Seq=1 Ack=518 Win=28160 Len=0 TSval=1637463265 TSecr=2707878753"
"288","5.720707420","52.201.141.91","192.168.1.208","TLSv1.2","2962","Server Hello"
"289","5.720742790","192.168.1.208","52.201.141.91","TCP","66","46110  >  443 [ACK] Seq=518 Ack=2897 Win=63488 Len=0 TSval=2707878791 TSecr=1637463265"
"290","5.722594593","52.201.141.91","192.168.1.208","TLSv1.2","2054","Certificate, Server Key Exchange, Server Hello Done"
"291","5.722629340","192.168.1.208","52.201.141.91","TCP","66","46110  >  443 [ACK] Seq=518 Ack=4885 Win=63872 Len=0 TSval=2707878793 TSecr=1637463265"
"292","5.722594990","68.67.181.211","192.168.1.208","TCP","66","443  >  48826 [ACK] Seq=1 Ack=518 Win=30720 Len=0 TSval=818295759 TSecr=2093655428"
"293","5.727263107","68.67.181.211","192.168.1.208","TLSv1.2","1514","Server Hello"
"294","5.727304742","192.168.1.208","68.67.181.211","TCP","66","48826  >  443 [ACK] Seq=518 Ack=1449 Win=63104 Len=0 TSval=2093655472 TSecr=818295759"
"295","5.729029977","68.67.181.211","192.168.1.208","TLSv1.2","1268","Certificate, Certificate Status, Server Key Exchange, Server Hello Done"
"296","5.729051910","192.168.1.208","68.67.181.211","TCP","66","48826  >  443 [ACK] Seq=518 Ack=2651 Win=64128 Len=0 TSval=2093655474 TSecr=818295759"
"297","5.729030331","107.178.246.49","192.168.1.208","TCP","66","443  >  45336 [ACK] Seq=824 Ack=1326 Win=68096 Len=0 TSval=48468251 TSecr=859636909"
"298","5.729030435","54.198.177.131","192.168.1.208","TCP","66","443  >  42308 [ACK] Seq=1 Ack=518 Win=28160 Len=0 TSval=374716624 TSecr=4032400244"
"299","5.731117418","192.168.1.208","52.201.141.91","TLSv1.2","192","Client Key Exchange, Change Cipher Spec, Encrypted Handshake Message"
"300","5.731241646","54.198.177.131","192.168.1.208","TLSv1.2","1514","Server Hello"
"301","5.731268596","192.168.1.208","54.198.177.131","TCP","66","42308  >  443 [ACK] Seq=518 Ack=1449 Win=63104 Len=0 TSval=4032400292 TSecr=374716624"
"302","5.731931779","192.168.1.208","52.201.141.91","TLSv1.2","165","Application Data"
"303","5.732316385","192.168.1.208","52.201.141.91","TLSv1.2","556","Application Data"
"304","5.733571831","54.198.177.131","192.168.1.208","TCP","2962","443  >  42308 [ACK] Seq=1449 Ack=518 Win=28160 Len=2896 TSval=374716624 TSecr=4032400244 [TCP segment of a reassembled PDU]"
"305","5.733600750","192.168.1.208","54.198.177.131","TCP","66","42308  >  443 [ACK] Seq=518 Ack=4345 Win=63488 Len=0 TSval=4032400295 TSecr=374716624"
"306","5.735330566","54.198.177.131","192.168.1.208","TLSv1.2","999","Certificate, Server Key Exchange, Server Hello Done"
"307","5.735357673","192.168.1.208","54.198.177.131","TCP","66","42308  >  443 [ACK] Seq=518 Ack=5278 Win=64128 Len=0 TSval=4032400296 TSecr=374716624"
"308","5.735331134","107.178.246.49","192.168.1.208","TLSv1.3","602","Application Data"
"309","5.735404547","192.168.1.208","107.178.246.49","TCP","66","45336  >  443 [ACK] Seq=1326 Ack=1360 Win=64128 Len=0 TSval=859636936 TSecr=48468261"
"310","5.735331239","107.178.246.49","192.168.1.208","TLSv1.3","223","Application Data, Application Data"
"311","5.735417810","192.168.1.208","107.178.246.49","TCP","66","45336  >  443 [ACK] Seq=1326 Ack=1517 Win=64128 Len=0 TSval=859636936 TSecr=48468261"
"312","5.735331346","107.178.246.49","192.168.1.208","TLSv1.3","105","Application Data"
"313","5.735427739","192.168.1.208","107.178.246.49","TCP","66","45336  >  443 [ACK] Seq=1326 Ack=1556 Win=64128 Len=0 TSval=859636936 TSecr=48468262"
"314","5.745106184","192.168.1.208","68.67.181.211","TLSv1.2","192","Client Key Exchange, Change Cipher Spec, Encrypted Handshake Message"
"315","5.749631070","199.187.193.166","192.168.1.208","TLSv1.3","2730","Server Hello, Change Cipher Spec, Application Data, Application Data, Application Data, Application Data"
